{
  "id": "panna",
  "term_ru": "панья",
  "term_iast": "paññā",
  "term_composition": {
    "is_compound": false,
    "components": [],
    "note": ""
  },
  "origin": {
    "type": "заимствован и переосмыслен",
    "source_tradition": "Обычное индийское слово «знание, понимание»; буддизм сделал из него название глубокого понимания, которое освобождает.",
    "attestation_before_term": "В санскрите есть слово prajñā («знание, понимание, разумение»); оно встречается в ведийской и упанишадной литературе.",
    "etymology_versions": [
      {
        "version": "Приставка pa- («вперёд, ясно») + корень ñā («знать»): «ясное знание, проникновение».",
        "type": "академическая (филологическая)",
        "version_source": "Словарь палийского языка Общества палийских текстов (PTS)",
        "status": "доминирующая"
      },
      {
        "version": "«Знание различными способами»: умение видеть вещи так, как они есть, во всех их особенностях.",
        "type": "традиционная / народная",
        "version_source": "Буддхагхоса, Висуддхимагга, глава 14",
        "status": "принята в традиции"
      }
    ]
  },
  "dating": [
    {
      "type": "добуддийское бытование",
      "value": "ведийский и упанишадный период, до V в. до н. э.",
      "comment": "В форме prajñā («знание, понимание»)."
    },
    {
      "type": "традиционная",
      "value": "время жизни Будды, V в. до н. э.",
      "comment": "Мудрость названа третьим из трёх упражнений: нравственность, сосредоточение, мудрость."
    },
    {
      "type": "академическая",
      "value": "ранний пласт Палийского канона, примерно V–IV вв. до н. э.",
      "comment": "Точно датировать отдельные суттры нельзя."
    }
  ],
  "attribution": {
    "traditional": "Традиция приписывает Будде употребление слова для понимания Четырёх благородных истин, которое освобождает ум. Мудрость названа вершиной трёх упражнений.",
    "academic": "Учёные согласны, что слово существовало и до буддизма. Особенность буддийского понимания в том, что мудрость — это не знание вообще, а прямое видение непостоянства, страдания и отсутствия «я». Спорным остаётся, чем она отличается от близких слов вроде «знание» и «осознанность».",
    "consensus": "Согласие по основным вопросам: слово заимствованное, а его буддийское употребление раннее."
  },
  "recorded_by": "Составители Палийского канона (долго передавался устно, письменно записан на Шри-Ланке в I в. до н. э.)",
  "school_tradition": "Тхеравада (понятие общее для всех буддийских школ; на санскрите — праджня)",
  "reason_introduced": "Нужно было назвать то, что действительно освобождает: не вера и не правила, а ясное видение того, как всё устроено. Без него даже самая строгая нравственность и самое глубокое сосредоточение остаются на полпути.",
  "interpretation": "Мудрость: ясное и прямое понимание, как всё устроено на самом деле. Это видение непостоянства, страдания и отсутствия постоянного «я», а также понимание Четырёх благородных истин. Она называется последним из трёх упражнений и в то же время самой основой пути.",
  "language": "пали",
  "sources": [
    {
      "status": "основной",
      "title": "Маха-ведалла-сутта (Большая сутта о вопросах и ответах)",
      "location": "Majjhima Nikāya 43",
      "transmission_tradition": "Тхеравада",
      "language": "пали",
      "source_type": "канонический (Сутта-питака)",
      "discrepancies": ""
    },
    {
      "status": "свидетель 1",
      "title": "Сикка-сутта (Сутта о трёх упражнениях)",
      "location": "Aṅguttara Nikāya 3.88–3.89",
      "transmission_tradition": "Тхеравада",
      "language": "пали",
      "source_type": "канонический (Сутта-питака)",
      "discrepancies": ""
    },
    {
      "status": "свидетель 2",
      "title": "Махапариниббана-сутта (Большая сутта о полном угасании)",
      "location": "Dīgha Nikāya 16",
      "transmission_tradition": "Тхеравада",
      "language": "пали",
      "source_type": "канонический (Сутта-питака)",
      "discrepancies": "Параллельные версии сохранились в китайском и санскритском каноне."
    }
  ],
  "later_mentions": [
    {
      "id": "buddhaghosa",
      "parent": "root",
      "author_id": "buddhaghosa",
      "date_updated": "V в. н. э.",
      "updated_by": "Буддхагхоса",
      "reason_for_update": "Нужно было дать подробный порядок развития мудрости: с чего она начинается и как растёт.",
      "what_is_new": "Мудрость рассматривается как конечная часть пути очищения. Подробно описываются ступени знания, которые проходит практикующий, от различения явлений до прямого видения освобождения.",
      "school_tradition": "Тхеравада (комментаторская традиция)",
      "source_type": "комментарий / трактат",
      "language": "пали",
      "source": { "title": "Висуддхимагга" }
    },
    {
      "id": "prajnaparamita",
      "parent": "root",
      "author_id": "prajnaparamita",
      "date_updated": "начиная примерно с I в. до н. э.",
      "updated_by": "авторы сутр о совершенной мудрости",
      "reason_for_update": "Нужно было описать мудрость, которая видит не только отсутствие «я» в человеке, но и отсутствие устойчивой природы у всех явлений.",
      "what_is_new": "Мудрость (праджня) понимается как прямое видение «пустоты»: у вещей нет самостоятельной, неизменной сущности. Она становится главным из шести совершенств бодхисаттвы.",
      "school_tradition": "Махаяна",
      "source_type": "канонический (махаянские сутры)",
      "language": "санскрит",
      "source": { "title": "Праджняпарамита-сутры" }
    }
  ]
}
