{
  "id": "pancasila",
  "term_ru": "панчасила",
  "term_iast": "pañcasīla",
  "term_composition": {
    "is_compound": true,
    "components": [
      { "part_iast": "pañca", "part_meaning": "пять" },
      { "part_iast": "sīla", "part_meaning": "нравственные правила" }
    ],
    "note": "Вместе получается «пять правил нравственности»: пять обязательств, принимаемых мирянами."
  },
  "origin": {
    "type": "заимствован и переосмыслен",
    "source_tradition": "Сходные перечни обетов были в индийской аскетической среде, например в джайнизме; буддизм собрал пять правил в особый перечень для мирян.",
    "attestation_before_term": "Похожие перечни воздержаний (не убивать, не лгать, не красть) встречаются в джайнской и брахманской аскетической традиции до или параллельно с буддизмом.",
    "etymology_versions": [
      {
        "version": "Pañca («пять») + sīla («нравственные правила»): «пять правил».",
        "type": "академическая (филологическая)",
        "version_source": "Словарь палийского языка Общества палийских текстов (PTS)",
        "status": "доминирующая"
      },
      {
        "version": "В суттах эти правила чаще называются «пять правил обучения» (pañca sikkhāpadāni), то есть «пять предметов упражнения». Сложное слово pañcasīla больше употребляется в комментариях.",
        "type": "традиционная / народная",
        "version_source": "Тхеравадинские комментарии",
        "status": "принята в традиции"
      }
    ]
  },
  "dating": [
    {
      "type": "добуддийское бытование",
      "value": "до V в. до н. э.",
      "comment": "Отдельные воздержания в индийской аскетической традиции."
    },
    {
      "type": "традиционная",
      "value": "время жизни Будды, V в. до н. э.",
      "comment": "Пять правил даны мирянам с первых лет проповеди."
    },
    {
      "type": "академическая",
      "value": "ранний пласт Палийского канона, примерно V–IV вв. до н. э.",
      "comment": "Точно датировать отдельные суттры нельзя; сам термин в виде одного слова встречается позднее."
    }
  ],
  "attribution": {
    "traditional": "Традиция приписывает Будде пять правил для мирян: не убивать, не красть, не вести себя вредно в сфере чувств, не лгать, не употреблять опьяняющее.",
    "academic": "Учёные согласны, что сами правила принадлежат раннему слою канона. Спорным остаётся, насколько они заимствованы из джайнской и брахманской среды и в какой мере буддизм их переосмыслил.",
    "consensus": "Согласие по основным вопросам: правила раннее; степень заимствования обсуждается."
  },
  "recorded_by": "Составители Палийского канона (долго передавался устно, письменно записан на Шри-Ланке в I в. до н. э.)",
  "school_tradition": "Тхеравада (понятие общее для всех буддийских школ; на санскрите — панчашила)",
  "reason_introduced": "Нужно было дать мирянам простую и посильную основу нравственности: несколько правил, которые помогают не вредить себе и другим и не разрушают спокойствия ума.",
  "interpretation": "Пять правил, которые принимает мирянин: не лишать жизни, не брать чужого, не вести себя вредно в сфере чувственных отношений, не лгать, не употреблять опьяняющего, что затуманивает ум. Это не заповеди, данные свыше, а обязательства, которые человек берёт на себя добровольно.",
  "language": "пали",
  "sources": [
    {
      "status": "основной",
      "title": "Велудвареййя-сутта (Сутта о жителях Велудвары)",
      "location": "Saṃyutta Nikāya 55.7",
      "transmission_tradition": "Тхеравада",
      "language": "пали",
      "source_type": "канонический (Сутта-питака)",
      "discrepancies": "Здесь правила объяснены через сравнение себя с другими: как не хочу страдать я, так и другие."
    },
    {
      "status": "свидетель 1",
      "title": "Дхаммапада (стихи о нарушениях пяти правил)",
      "location": "Dhammapada 246–247",
      "transmission_tradition": "Тхеравада",
      "language": "пали",
      "source_type": "канонический (Кхуддака-никая)",
      "discrepancies": "Существуют параллельные версии на санскрите и других языках."
    },
    {
      "status": "свидетель 2",
      "title": "Кхуддакапатха (десять правил обучения, куда входят пять)",
      "location": "Khuddakapāṭha 2",
      "transmission_tradition": "Тхеравада",
      "language": "пали",
      "source_type": "канонический (Кхуддака-никая)",
      "discrepancies": ""
    }
  ],
  "later_mentions": [
    {
      "id": "buddhaghosa",
      "parent": "root",
      "author_id": "buddhaghosa",
      "date_updated": "V в. н. э.",
      "updated_by": "Буддхагхоса",
      "reason_for_update": "Нужно было отличить правила, которые мирянин соблюдает постоянно, от тех, что берутся на отдельные дни.",
      "what_is_new": "В комментариях пять правил закрепляются как постоянная нравственность мирянина. Восемь правил, которые принимают в особые дни, рассматриваются как её расширение.",
      "school_tradition": "Тхеравада (комментаторская традиция)",
      "source_type": "комментарий / трактат",
      "language": "пали",
      "source": { "title": "Висуддхимагга" }
    }
  ]
}
