{
  "id": "brahmavihara",
  "term_ru": "брахмавихара",
  "term_iast": "brahmavihāra",
  "term_composition": {
    "is_compound": true,
    "components": [
      {
        "part_iast": "brahma",
        "part_meaning": "высший, божественный, Брахма"
      },
      {
        "part_iast": "vihāra",
        "part_meaning": "пребывание, жилище"
      }
    ],
    "note": "«Божественные пребывания»: состояния ума, в которых человек живёт так, как, по индийским представлениям, живут боги мира Брахмы."
  },
  "origin": {
    "type": "введён впервые",
    "source_tradition": "Буддийское название для набора из четырёх состояний: доброжелательности, сострадания, сорадования и уравновешенности. Оба слова обычные, но их соединение и сам набор характерны для буддизма.",
    "attestation_before_term": "Брахман и бог Брахма — центральные понятия ведийской и упанишадской религии; «единение с Брахмой» было целью брахманов, с которыми спорил Будда.",
    "etymology_versions": [
      {
        "version": "brahma («высший, божественный») + vihāra («пребывание»): «высшее, наилучшее пребывание» или «пребывание, как у Брахмы».",
        "type": "академическая (филологическая)",
        "version_source": "Словарь палийского языка Общества палийских текстов (PTS)",
        "status": "доминирующая"
      },
      {
        "version": "Эти состояния названы «брахма-», потому что они наилучшие и чистые, а также потому, что так живут боги мира Брахмы.",
        "type": "традиционная / народная",
        "version_source": "Буддхагхоса, Висуддхимагга",
        "status": "принята в традиции"
      }
    ]
  },
  "dating": [
    {
      "type": "традиционная",
      "value": "время жизни Будды, V в. до н. э.",
      "comment": "Будда объясняет брахманам, что путь к Брахме — это развитие четырёх безмерных состояний."
    },
    {
      "type": "академическая",
      "value": "ранний пласт Палийского канона, примерно V–IV вв. до н. э.",
      "comment": "Слово «брахмавихара» встречается реже, чем «четыре безмерных» (appamaññā); оба названия обозначают один набор."
    }
  ],
  "attribution": {
    "traditional": "Традиция приписывает Будде и сам набор, и название: в «Тевиджа-сутте» он отвечает брахманам, что единение с Брахмой достигается не обрядами, а доброжелательностью, состраданием, сорадованием и уравновешенностью.",
    "academic": "Многие учёные видят здесь переосмысление брахманской цели: Будда взял знакомый слушателям образ и наполнил его этическим содержанием. Спорным остаётся вопрос, считались ли эти состояния в ранний период самостоятельным путём к освобождению (так думал Р. Гомбрич) или только подготовкой к нему, как в позднейшей традиции.",
    "consensus": "Частичное согласие: смысл набора ясен, его место на пути к освобождению обсуждается."
  },
  "recorded_by": "Составители Палийского канона (долго передавался устно, письменно записан на Шри-Ланке в I в. до н. э.)",
  "school_tradition": "Тхеравада (понятие общее для всех буддийских школ)",
  "reason_introduced": "Нужно было объединить четыре добрых настроя ума в одну практику и показать брахманам, что «пребывание с Брахмой» — это не обряд, а состояние ума, которое человек может развить сам.",
  "interpretation": "Общее название четырёх «безмерных» состояний ума: доброжелательности, сострадания, сорадования и уравновешенности. Безмерными они называются потому, что их распространяют на всех существ без границ. Их развивают в медитации и в повседневной жизни; они делают ум спокойным и открытым.",
  "language": "пали",
  "sources": [
    {
      "status": "основной",
      "title": "Тевиджа-сутта (Сутта о знатоках трёх Вед)",
      "location": "Dīgha Nikāya 13",
      "transmission_tradition": "Тхеравада",
      "language": "пали",
      "source_type": "канонический (Сутта-питака)",
      "discrepancies": "Четыре состояния названы путём к общению с Брахмой."
    },
    {
      "status": "свидетель 1",
      "title": "Ваттхупама-сутта (Сутта о сравнении с тканью)",
      "location": "Majjhima Nikāya 7",
      "transmission_tradition": "Тхеравада",
      "language": "пали",
      "source_type": "канонический (Сутта-питака)",
      "discrepancies": "Формула «наполняет одну сторону света умом, исполненным…» одинакова для всех четырёх состояний."
    },
    {
      "status": "свидетель 2",
      "title": "Каранияметта-сутта (Сутта о доброжелательности)",
      "location": "Sutta Nipāta 1.8",
      "transmission_tradition": "Тхеравада",
      "language": "пали",
      "source_type": "канонический (Сутта-питака)",
      "discrepancies": "Метта прямо названа «божественным пребыванием» (brahmam etaṃ vihāraṃ)."
    }
  ],
  "later_mentions": [
    {
      "id": "abhidhamma",
      "parent": "root",
      "author_id": "abhidhamma",
      "date_updated": "поздний пласт канона",
      "updated_by": "составители Абхидхамма-питаки",
      "reason_for_update": "Нужно было точно описать, что происходит в уме при развитии этих состояний.",
      "what_is_new": "В «Вибханге» им посвящена отдельная глава под названием «безмерные» (appamaññā); каждое состояние разобрано по стандартной схеме.",
      "school_tradition": "Тхеравада (Абхидхамма)",
      "source_type": "канонический (Абхидхамма-питака)",
      "language": "пали",
      "source": {
        "title": "Вибханга"
      }
    },
    {
      "id": "buddhaghosa",
      "parent": "root",
      "author_id": "buddhaghosa",
      "date_updated": "V в. н. э.",
      "updated_by": "Буддхагхоса",
      "reason_for_update": "Нужно было объяснить практику подробно: как её развивать и как не спутать с похожими, но вредными состояниями.",
      "what_is_new": "Отдельная глава описывает все четыре состояния: их признаки, «ближних» и «дальних» врагов, порядок практики и пользу. Объяснено, почему их ровно четыре и почему они идут именно в таком порядке.",
      "school_tradition": "Тхеравада (комментаторская традиция)",
      "source_type": "комментарий / трактат",
      "language": "пали",
      "source": {
        "title": "Висуддхимагга"
      }
    }
  ]
}
