{
  "id": "sotapatti",
  "term_ru": "сотапатти",
  "term_iast": "sotāpatti",
  "term_composition": {
    "is_compound": true,
    "components": [
      { "part_iast": "sota", "part_meaning": "поток, течение" },
      { "part_iast": "āpatti", "part_meaning": "вхождение, достижение" }
    ],
    "note": "Вместе получается «вхождение в поток» — первое достижение на пути к освобождению."
  },
  "origin": {
    "type": "введён впервые",
    "source_tradition": "",
    "attestation_before_term": "",
    "etymology_versions": [
      {
        "version": "sota («поток») + āpatti («вхождение», от ā + pad — «достигать, входить»): «вхождение в поток». Тот, кто достиг этого, называется сотапанна.",
        "type": "академическая (филологическая)",
        "version_source": "Словарь палийского языка Общества палийских текстов (PTS); общепринятое чтение",
        "status": "доминирующая"
      },
      {
        "version": "«Поток» — это сам Благородный восьмеричный путь; войти в поток значит впервые вступить на этот путь по-настоящему.",
        "type": "традиционная / народная",
        "version_source": "Тхеравадинская традиция: Сотапатти-саньютта (Saṃyutta Nikāya 55) и комментарии",
        "status": "принята в традиции"
      }
    ]
  },
  "dating": [
    {
      "type": "традиционная",
      "value": "время жизни Будды, V в. до н. э.",
      "comment": "Термин встречается уже в беседах Будды с учениками."
    },
    {
      "type": "академическая",
      "value": "ранний пласт Палийского канона, примерно V–IV вв. до н. э.",
      "comment": "Точно датировать отдельные суттры нельзя; термин относят к самому раннему слою текстов."
    }
  ],
  "attribution": {
    "traditional": "Традиция приписывает его самому Будде: он называл так первую ступень благородных учеников и рассказывал о ней как о надёжной опоре на пути.",
    "academic": "Учёные считают, что понятие входит в ранний слой учения. О том, как рано сложилась именно четырёхступенчатая схема (вхождение в поток, однажды-возвращающийся, невозвращающийся, архат), мнения различаются.",
    "consensus": "Согласие, что термин ранний и принадлежит самому раннему слою канона; споры идут о деталях схемы ступеней."
  },
  "recorded_by": "Составители Палийского канона (долго передавался устно, письменно записан на Шри-Ланке в I в. до н. э.)",
  "school_tradition": "Тхеравада (близкие понятия есть и в других ранних школах)",
  "reason_introduced": "Нужно было назвать первый надёжный рубеж на пути: человек, который уже увидел учение собственным опытом и не свернёт с пути. Образ потока показывает, что дальше идёт течение к освобождению.",
  "interpretation": "Первая ступень на пути к освобождению. Человек впервые ясно видит Четыре благородные истины и отбрасывает три первых оков: веру в неизменное «я», сомнение и привязанность к обрядам. Считается, что он уже не упадёт в низшие миры и достигнет освобождения не позднее чем через семь рождений.",
  "language": "пали",
  "sources": [
    {
      "status": "основной",
      "title": "Сотапатти-саньютта (Группа бесед о вхождении в поток)",
      "location": "Saṃyutta Nikāya 55",
      "transmission_tradition": "Тхеравада",
      "language": "пали",
      "source_type": "канонический (Сутта-питака)",
      "discrepancies": ""
    },
    {
      "status": "свидетель 1",
      "title": "Махапариниббана-сутта (Большая сутта о полном угасании)",
      "location": "Dīgha Nikāya 16",
      "transmission_tradition": "Тхеравада",
      "language": "пали",
      "source_type": "канонический (Сутта-питака)",
      "discrepancies": "Параллельные версии сохранились в китайском и санскритском каноне; термин там звучит как sotāpanna / srotāpanna."
    }
  ],
  "later_mentions": [
    {
      "id": "buddhaghosa",
      "parent": "root",
      "author_id": "buddhaghosa",
      "date_updated": "V в. н. э.",
      "updated_by": "Буддхагхоса",
      "reason_for_update": "Со временем нужно было точно описать, что именно происходит в уме в момент вхождения в поток, и чем оно отличается от последующего состояния.",
      "what_is_new": "Комментаторская традиция разделяет два момента: сам прорыв («путь вхождения в поток») и закрепление его результата («плод вхождения в поток»). Описывается подробный порядок прохождения ступеней очищения.",
      "school_tradition": "Тхеравада (комментаторская традиция)",
      "source_type": "комментарий / трактат",
      "language": "пали",
      "source": { "title": "Висуддхимагга" }
    }
  ]
}
