{
  "id": "samadhi",
  "term_ru": "самадхи",
  "term_iast": "samādhi",
  "term_composition": {
    "is_compound": false,
    "components": [],
    "note": ""
  },
  "origin": {
    "type": "заимствован и переосмыслен",
    "source_tradition": "Обычное индийское слово «собирание, соединение»; в индийской аскетической среде оно применялось и к сосредоточению ума. Буддизм сделал из него название определённого вида ясного и устойчивого ума.",
    "attestation_before_term": "В санскрите слово samādhi означает «собирание, соединение, сосредоточение». Применялось ли оно в значении сосредоточения ума до Будды, достоверно неизвестно; в ранней упанишадной литературе его употребление не подтверждено.",
    "etymology_versions": [
      {
        "version": "Приставки saṃ («вместе») и ā («к») + корень dhā («класть, ставить»): «собранное, установленное вместе».",
        "type": "академическая (филологическая)",
        "version_source": "Словарь палийского языка Общества палийских текстов (PTS)",
        "status": "доминирующая"
      },
      {
        "version": "«Правильное и ровное установление ума на предмете»: ум стоит устойчиво, не колеблясь.",
        "type": "традиционная / народная",
        "version_source": "Буддхагхоса, Висуддхимагга, глава 3",
        "status": "принята в традиции"
      }
    ]
  },
  "dating": [
    {
      "type": "традиционная",
      "value": "время жизни Будды, V в. до н. э.",
      "comment": "Сосредоточение названо вторым из трёх упражнений и восьмой ступенью благородного восьмеричного пути."
    },
    {
      "type": "академическая",
      "value": "ранний пласт Палийского канона, примерно V–IV вв. до н. э.",
      "comment": "Точно датировать отдельные суттры нельзя."
    }
  ],
  "attribution": {
    "traditional": "Традиция приписывает Будде употребление слова для устойчивого, собранного ума, который открывает путь к ясному видению.",
    "academic": "Учёные согласны, что практика сосредоточения была известна в Индии до Будды. Особенность буддийского подхода в том, что сосредоточение служит основой для мудрости, а не самоцелью. Спорным остаётся, насколько буддийское понимание отличалось от добуддийского.",
    "consensus": "Согласие по основным вопросам: слово заимствованное, а его буддийское употребление раннее."
  },
  "recorded_by": "Составители Палийского канона (долго передавался устно, письменно записан на Шри-Ланке в I в. до н. э.)",
  "school_tradition": "Тхеравада (понятие общее для всех буддийских школ; на санскрите — самадхи)",
  "reason_introduced": "Нужно было назвать состояние ума, в котором он спокоен и собран, а потому способен видеть ясно. Рассеянный ум не может по-настоящему понять учение.",
  "interpretation": "Сосредоточение: устойчивость и собранность ума на одном предмете. Это не сон и не потеря сознания, а ясный и спокойный ум. В благородном восьмеричном пути оно называется «правильным сосредоточением» и описывается как четыре ступени глубокого спокойствия.",
  "language": "пали",
  "sources": [
    {
      "status": "основной",
      "title": "Чулаведдалла-сутта (Малая сутта о вопросах и ответах)",
      "location": "Majjhima Nikāya 44",
      "transmission_tradition": "Тхеравада",
      "language": "пали",
      "source_type": "канонический (Сутта-питака)",
      "discrepancies": "Здесь сосредоточение определено как однонаправленность ума."
    },
    {
      "status": "свидетель 1",
      "title": "Саманнапхала-сутта (Сутта о плодах подвижничества)",
      "location": "Dīgha Nikāya 2",
      "transmission_tradition": "Тхеравада",
      "language": "пали",
      "source_type": "канонический (Сутта-питака)",
      "discrepancies": "Параллельные версии есть в китайском и санскритском каноне."
    },
    {
      "status": "свидетель 2",
      "title": "Сикка-сутта (Сутта о трёх упражнениях)",
      "location": "Aṅguttara Nikāya 3.88–3.89",
      "transmission_tradition": "Тхеравада",
      "language": "пали",
      "source_type": "канонический (Сутта-питака)",
      "discrepancies": ""
    }
  ],
  "later_mentions": [
    {
      "id": "buddhaghosa",
      "parent": "root",
      "author_id": "buddhaghosa",
      "date_updated": "V в. н. э.",
      "updated_by": "Буддхагхоса",
      "reason_for_update": "Нужно было описать степени сосредоточения, чтобы практикующий понимал, на каком этапе он находится.",
      "what_is_new": "В трактате сосредоточение делится на три вида: мгновенное (кратковременное, в повседневной жизни), приближающееся (перед глубоким состоянием) и полное (глубокое погружение).",
      "school_tradition": "Тхеравада (комментаторская традиция)",
      "source_type": "комментарий / трактат",
      "language": "пали",
      "source": { "title": "Висуддхимагга" }
    }
  ]
}
