{
  "id": "jati",
  "term_ru": "джати",
  "term_iast": "jāti",
  "term_composition": {
    "is_compound": false,
    "components": [],
    "note": ""
  },
  "origin": {
    "type": "заимствован и переосмыслен",
    "source_tradition": "ведийская и раннеиндийская традиция",
    "attestation_before_term": "Встречается в ведийских текстах (Ригведа, упанишады) в значениях рождение, происхождение, род, каста.",
    "etymology_versions": [
      {
        "version": "Образовано от санскритского/палийского корня jan- (рождаться, производить) с добавлением суффикса женского рода -ti.",
        "type": "академическая (филологическая)",
        "version_source": "PTS Pali-English Dictionary, санскритская грамматическая традиция",
        "status": "доминирующая"
      }
    ]
  },
  "dating": [
    {
      "type": "добуддийское бытование",
      "value": "I тыс. до н.э.",
      "comment": "Термин активно использовался в ведийском санскрите задолго до возникновения буддизма."
    },
    {
      "type": "академическая",
      "value": "V–IV вв. до н.э.",
      "comment": "Период проповеди Будды Буддхагаи и формирования ранних буддийских текстов."
    }
  ],
  "attribution": {
    "traditional": "Будде Шакьямуни, который включил этот термин в учение о двенадцати звеньях взаимозависимого возникновения и в первую благородную истину.",
    "academic": "Термин существовал в индийской языковой среде; Будда придал ему специфическое философско-психологическое и сотериологическое значение.",
    "consensus": "Полный консенсус: термин заимствован из общеиндийского контекста и переосмыслен в буддийском учении."
  },
  "recorded_by": "Монахи раннебуддийской общины (сангхи) в ходе устной передачи и затем на Первом и Четвёртом (в Шри-Ланке) буддийских соборах.",
  "school_tradition": "Ранний буддизм, Тхеравада",
  "reason_introduced": "Понятие потребовалось, чтобы объяснить, как поступки в прошлой жизни приводят к появлению нового живого существа. Будда показал, что рождение — это не подарок свыше и не случайность, а событие, которое неизбежно влечёт за собой старение, болезни и страдания.",
  "interpretation": "Джати обозначает рождение живого существа в конкретном мире, а также сам факт появления чего-либо на свет. В учении о взаимозависимом происхождении это 11-е звено цепи, из-за которого человек снова появляется в телесном обличье и обретает органы чувств. Рождение считается главным источником всех последующих жизненных трудностей и страданий.",
  "language": "пали (от санскритского jāti)",
  "sources": [
    {
      "status": "основной",
      "title": "Маханидана-сутта",
      "location": "Dīgha Nikāya 15",
      "transmission_tradition": "Тхеравада",
      "language": "пали",
      "source_type": "канонический (Сутта-питака)",
      "discrepancies": ""
    },
    {
      "status": "свидетель 1",
      "title": "Дхаммачаккаппаваттана-сутта",
      "location": "Samyutta Nikāya 56.11",
      "transmission_tradition": "Тхеравада",
      "language": "пали",
      "source_type": "канонический (Сутта-питака)",
      "discrepancies": ""
    },
    {
      "status": "свидетель 2",
      "title": "Вибханга-сутта",
      "location": "Samyutta Nikāya 12.2",
      "transmission_tradition": "Тхеравада",
      "language": "пали",
      "source_type": "канонический (Сутта-питака)",
      "discrepancies": ""
    }
  ],
  "later_mentions": [
    {
      "id": "buddhaghosa-visuddhimagga",
      "parent": "root",
      "author_id": "buddhaghosa",
      "date_updated": "V в. н.э.",
      "updated_by": "Буддхагхоса",
      "reason_for_update": "Требовалось подробное систематическое объяснение канонических терминов для монахов и комментаторской традиции.",
      "what_is_new": "Рождение детально описано через медицинские и физиологические подробности пребывания в утробе, а также классифицировано по типам зарождения (из яйца, из чрева, из влаги, самопроизвольное).",
      "school_tradition": "Тхеравада",
      "source_type": "комментаторский (Аттхакатха)",
      "language": "пали",
      "source": {
        "title": "Висуддхимагга"
      }
    }
  ]
}