{
  "id": "satipatthana",
  "term_ru": "сатипаттхана",
  "term_iast": "satipaṭṭhāna",
  "term_composition": {
    "is_compound": true,
    "components": [
      { "part_iast": "sati", "part_meaning": "памятование, внимательность" },
      { "part_iast": "upaṭṭhāna", "part_meaning": "установление, присутствие" }
    ],
    "note": "Вместе получается «установление внимательности»: умение удерживать ум в присутствии. Часть слова можно читать и как paṭṭhāna («основание»), тогда получается «основа внимательности»."
  },
  "origin": {
    "type": "введён впервые",
    "source_tradition": "",
    "attestation_before_term": "",
    "etymology_versions": [
      {
        "version": "Sati («памятование, внимательность») + upaṭṭhāna («установление, присутствие, служение»): «установление внимательности». Такое чтение предлагают ряд современных исследователей, в частности Аналайо.",
        "type": "академическая (филологическая)",
        "version_source": "Анализ в сравнительных исследованиях Аналайо",
        "status": "оспаривается"
      },
      {
        "version": "Sati («памятование») + paṭṭhāna («основание, опора»): «основы внимательности».",
        "type": "традиционная / народная",
        "version_source": "Тхеравадинские комментарии; перевод «основы внимательности» принят во многих изданиях",
        "status": "доминирующая"
      }
    ]
  },
  "dating": [
    {
      "type": "традиционная",
      "value": "время жизни Будды, V в. до н. э.",
      "comment": "Будда назвал четыре основы единственным путём очищения существ."
    },
    {
      "type": "академическая",
      "value": "ранний пласт Палийского канона, примерно V–IV вв. до н. э.",
      "comment": "Точно датировать отдельные суттры нельзя; сравнение с китайскими версиями показывает, что основное ядро наставления раннее."
    }
  ],
  "attribution": {
    "traditional": "Традиция приписывает Будде наставление о четырёх основах внимательности: тело, чувства, ум и явления. Оно названо прямым путём очищения существ.",
    "academic": "Учёные согласны, что наставление принадлежит раннему слою канона. Спорным остаётся, какие из упражнений входили в самое раннее ядро, а какие добавились позже. Китайская параллельная версия отличается составом отдельных упражнений.",
    "consensus": "Согласие по основным вопросам: наставление раннее; состав упражнений обсуждается."
  },
  "recorded_by": "Составители Палийского канона (долго передавался устно, письменно записан на Шри-Ланке в I в. до н. э.)",
  "school_tradition": "Тхеравада (понятие общее для всех буддийских школ; на санскрите — смритьюпастхана)",
  "reason_introduced": "Нужно было дать ученикам простой и прямой способ начать практику: наблюдать то, что происходит прямо сейчас, в теле, чувствах, уме и в самих явлениях опыта, вместо того чтобы блуждать в мыслях.",
  "interpretation": "Четыре основы внимательности: наблюдение за телом, за чувствами, за состоянием ума и за явлениями опыта. Так ученик учится видеть всё, что происходит, без осуждения и без привязанности. В традиции это называется прямым путём к очищению от страданий и тревог.",
  "language": "пали",
  "sources": [
    {
      "status": "основной",
      "title": "Сатипаттхана-сутта (Сутта об основах внимательности)",
      "location": "Majjhima Nikāya 10",
      "transmission_tradition": "Тхеравада",
      "language": "пали",
      "source_type": "канонический (Сутта-питака)",
      "discrepancies": "Параллельная версия есть в китайской Мадхьяма-агаме (MĀ 98); состав отдельных упражнений отличается."
    },
    {
      "status": "свидетель 1",
      "title": "Маха-сатипаттхана-сутта (Большая сутта об основах внимательности)",
      "location": "Dīgha Nikāya 22",
      "transmission_tradition": "Тхеравада",
      "language": "пали",
      "source_type": "канонический (Сутта-питака)",
      "discrepancies": "В этой версии раздел о Четырёх благородных истинах изложен подробнее, чем в МН 10."
    },
    {
      "status": "свидетель 2",
      "title": "Сатипаттхана-саньютта (Группа бесед об основах внимательности)",
      "location": "Saṃyutta Nikāya 47",
      "transmission_tradition": "Тхеравада",
      "language": "пали",
      "source_type": "канонический (Сутта-питака)",
      "discrepancies": ""
    }
  ],
  "later_mentions": [
    {
      "id": "buddhaghosa",
      "parent": "root",
      "author_id": "buddhaghosa",
      "date_updated": "V в. н. э.",
      "updated_by": "Буддхагхоса",
      "reason_for_update": "Нужно было объяснить, как именно следует понимать слово и как наставление вписывается в общий путь практики.",
      "what_is_new": "В комментариях разбирается значение слова и объясняется порядок упражнений. Наставление включается в общую схему развития успокоения и ясного видения.",
      "school_tradition": "Тхеравада (комментаторская традиция)",
      "source_type": "комментарий / трактат",
      "language": "пали",
      "source": { "title": "Висуддхимагга" }
    },
    {
      "id": "mahasi",
      "parent": "buddhaghosa",
      "author_id": "mahasi",
      "date_updated": "XX в.",
      "updated_by": "Махаси Саядо",
      "reason_for_update": "Нужен был доступный всем метод практики, который не требовал бы многолетнего ухода в лес.",
      "what_is_new": "В бирманской традиции наставление стало основой современной практики ясного видения. Её учат как систематический метод наблюдения за дыханием, движениями тела и мыслями, и приходят к ней люди, не живущие в монастыре.",
      "school_tradition": "Тхеравада (бирманская традиция)",
      "source_type": "современные руководства по практике",
      "language": "бирманский / пали",
      "source": { "title": "Руководства и лекции Махаси Саядо по випассане" }
    }
  ]
}
