{
  "id": "ariyasavaka",
  "term_ru": "ариясавака",
  "term_iast": "ariyasāvaka",
  "term_composition": {
    "is_compound": true,
    "components": [
      { "part_iast": "ariya", "part_meaning": "благородный" },
      { "part_iast": "sāvaka", "part_meaning": "слушающий, ученик" }
    ],
    "note": "Вместе получается «благородный ученик»: тот, кто не просто слушает учение, а уже сам увидел его истину."
  },
  "origin": {
    "type": "заимствован и переосмыслен",
    "source_tradition": "Обе части — обычные индийские слова; буддизм соединил их в название человека, достигшего первой ступени пути.",
    "attestation_before_term": "Слово ārya («благородный, достойный») известно ещё в ведийских текстах. Слово sāvaka («слушатель») образовано от глагола «слушать» и до буддизма означало просто ученика.",
    "etymology_versions": [
      {
        "version": "Ariya — «благородный» (в санскрите ārya); sāvaka — «слушающий» (от корня su — «слышать»). Благородный слушатель.",
        "type": "академическая (филологическая)",
        "version_source": "Словарь палийского языка Общества палийских текстов (PTS)",
        "status": "доминирующая"
      },
      {
        "version": "«Благородный» здесь означает не происхождение, а достижение: человек, который сам увидел истину и вышел из числа обычных людей.",
        "type": "традиционная / народная",
        "version_source": "Тхеравадинские комментарии",
        "status": "принята в традиции"
      }
    ]
  },
  "dating": [
    {
      "type": "добуддийское бытование",
      "value": "ведийский период, до V в. до н. э.",
      "comment": "Только отдельные слова: «благородный» и «слушатель»."
    },
    {
      "type": "традиционная",
      "value": "время жизни Будды, V в. до н. э.",
      "comment": "Будда противопоставлял благородного ученика обычному неучёному человеку."
    },
    {
      "type": "академическая",
      "value": "ранний пласт Палийского канона, примерно V–IV вв. до н. э.",
      "comment": "Точно датировать отдельные суттры нельзя."
    }
  ],
  "attribution": {
    "traditional": "Традиция приписывает Будде это выражение как название ученика, который уже достиг хотя бы первой ступени и увидел учение собственным опытом.",
    "academic": "Учёные согласны, что устойчивое сочетание принадлежит раннему слою канона. Спорным остаётся, всегда ли оно означало того, кто достиг первой ступени, или иногда и просто верующего ученика.",
    "consensus": "Согласие по основным вопросам: выражение раннее; о границах его значения мнения различаются."
  },
  "recorded_by": "Составители Палийского канона (долго передавался устно, письменно записан на Шри-Ланке в I в. до н. э.)",
  "school_tradition": "Тхеравада (понятие общее для всех буддийских школ; на санскрите — арьяшравака)",
  "reason_introduced": "Нужно было отличить человека, который уже увидел истину сам, от того, кто знает учение только по рассказам. Первого Будда называл благородным учеником, второго — обычным неучёным человеком.",
  "interpretation": "Ученик Будды, который достиг по меньшей мере первой ступени пути и увидел Четыре благородные истины. В текстах его часто противопоставляют «обычному человеку, не слушавшему учения». Благородный ученик знает, как надо смотреть на страдание и привязанность, и не теряет опоры.",
  "language": "пали",
  "sources": [
    {
      "status": "основной",
      "title": "Саббасава-сутта (Сутта обо всех влечениях)",
      "location": "Majjhima Nikāya 2",
      "transmission_tradition": "Тхеравада",
      "language": "пали",
      "source_type": "канонический (Сутта-питака)",
      "discrepancies": ""
    },
    {
      "status": "свидетель 1",
      "title": "Ассутава-сутта (Сутта о неучёном)",
      "location": "Saṃyutta Nikāya 12.61",
      "transmission_tradition": "Тхеравада",
      "language": "пали",
      "source_type": "канонический (Сутта-питака)",
      "discrepancies": ""
    },
    {
      "status": "свидетель 2",
      "title": "Сотапатти-саньютта (Группа бесед о вхождении в поток)",
      "location": "Saṃyutta Nikāya 55",
      "transmission_tradition": "Тхеравада",
      "language": "пали",
      "source_type": "канонический (Сутта-питака)",
      "discrepancies": "Параллельные версии есть в китайском и санскритском каноне."
    }
  ],
  "later_mentions": [
    {
      "id": "buddhaghosa",
      "parent": "root",
      "author_id": "buddhaghosa",
      "date_updated": "V в. н. э.",
      "updated_by": "Буддхагхоса",
      "reason_for_update": "Нужно было чётко определить, кого именно называют благородным учеником, чтобы не путать его с обычным верующим.",
      "what_is_new": "В комментариях выражение закрепляется как название человека, достигшего одной из четырёх ступеней пути, начиная с вхождения в поток. Обычный человек, хоть и слушает учение, к благородным ученикам не относится.",
      "school_tradition": "Тхеравада (комментаторская традиция)",
      "source_type": "комментарий / трактат",
      "language": "пали",
      "source": { "title": "Papañcasūdanī" }
    }
  ]
}
