{
  "id": "peta",
  "term_ru": "пета",
  "term_iast": "peta",
  "term_composition": {
    "is_compound": false,
    "components": [],
    "note": ""
  },
  "origin": {
    "type": "заимствован и переосмыслен",
    "source_tradition": "Обычное индийское слово «ушедший, умерший»; буддизм сделал из него название особого рода существ.",
    "attestation_before_term": "В санскрите слово preta означает «ушедший, умерший», то есть дух покойного, которому устраивали поминальные подношения.",
    "etymology_versions": [
      {
        "version": "От pra + i («идти вперёд, уходить»): «ушедший», «отошедший из этой жизни».",
        "type": "академическая (филологическая)",
        "version_source": "Словарь палийского языка Общества палийских текстов (PTS)",
        "status": "доминирующая"
      },
      {
        "version": "«Лишённый счастья», существо, у которого нет радости и благополучия.",
        "type": "традиционная / народная",
        "version_source": "Тхеравадинские комментарии",
        "status": "принята в традиции"
      }
    ]
  },
  "dating": [
    {
      "type": "добуддийское бытование",
      "value": "ведийский период, до V в. до н. э.",
      "comment": "Как слово «умерший, дух покойного»."
    },
    {
      "type": "традиционная",
      "value": "время жизни Будды, V в. до н. э.",
      "comment": "Будда и его ученики рассказывают о встречах с этими существами."
    },
    {
      "type": "академическая",
      "value": "ранний пласт Палийского канона, примерно V–IV вв. до н. э.",
      "comment": "Сборник Петаватту относят к более позднему слою Кхуддака-никаи."
    }
  ],
  "attribution": {
    "traditional": "Традиция приписывает Будде и его ученикам, прежде всего Маггалане, рассказы о таких существах. Маггалана, по преданию, видел их своим особым зрением.",
    "academic": "Учёные согласны, что представление о пете существовало в Индии до буддизма. Буддизм переосмыслил его: состояние петы стало результатом поступков, а не просто судьбой умерших без обрядов. Сборник Петаватту в нынешнем виде, вероятно, сложился позже самых ранних текстов.",
    "consensus": "Согласие по основным вопросам: слово заимствованное; о датировке сборников рассказов мнения различаются."
  },
  "recorded_by": "Составители Палийского канона (долго передавался устно, письменно записан на Шри-Ланке в I в. до н. э.)",
  "school_tradition": "Тхеравада (понятие общее для всех буддийских школ; на санскрите — прета)",
  "reason_introduced": "Нужно было объяснить, что бывает с людьми, которые прожили жизнь в скупости, жестокости или обмане, и показать на примерах, как поступки приводят к результатам. Рассказы о петах учили сочувствию и щедрости.",
  "interpretation": "Существо из мира «голодных духов»: оно постоянно мучается голодом, жаждой и неудовлетворённостью. Считается, что это результат прежней скупости и других проступков. Мир пет входит в число неблагоприятных уделов. Живые могут помочь таким существам, делясь с ними заслугами от добрых дел.",
  "language": "пали",
  "sources": [
    {
      "status": "основной",
      "title": "Петаватту (Рассказы о петах)",
      "location": "Khuddaka Nikāya, Petavatthu",
      "transmission_tradition": "Тхеравада",
      "language": "пали",
      "source_type": "канонический (Сутта-питака, Кхуддака-никая)",
      "discrepancies": "Сборник относят к позднему слою Кхуддака-никаи."
    },
    {
      "status": "свидетель 1",
      "title": "Лаккхана-саньютта (Группа бесед о признаках)",
      "location": "Saṃyutta Nikāya 19",
      "transmission_tradition": "Тхеравада",
      "language": "пали",
      "source_type": "канонический (Сутта-питака)",
      "discrepancies": "Здесь Маггалана рассказывает о том, что видел."
    },
    {
      "status": "свидетель 2",
      "title": "Балапандита-сутта (Сутта о глупце и мудреце)",
      "location": "Majjhima Nikāya 129",
      "transmission_tradition": "Тхеравада",
      "language": "пали",
      "source_type": "канонический (Сутта-питака)",
      "discrepancies": "Мир пет назван одним из неблагоприятных уделов."
    }
  ],
  "later_mentions": [
    {
      "id": "dhammapala",
      "parent": "root",
      "author_id": "dhammapala",
      "date_updated": "около VI в. н. э.",
      "updated_by": "Дхаммапала",
      "reason_for_update": "Нужно было пояснить каждый рассказ о петах: кто эти существа, за что страдают и как им можно помочь.",
      "what_is_new": "В комментариях каждый рассказ получает предысторию с пояснением, за какие поступки существо оказалось в мире пет. Подробнее разбирается передача заслуг умершим как способ им помочь.",
      "school_tradition": "Тхеравада (комментаторская традиция)",
      "source_type": "комментарий",
      "language": "пали",
      "source": { "title": "Paramatthadīpanī (комментарий к Петаватту)" }
    }
  ]
}
