{
  "id": "jaramarana",
  "term_ru": "жара-марана",
  "term_iast": "jarāmaraṇa",
  "term_composition": {
    "is_compound": true,
    "components": [
      {
        "part_iast": "jarā",
        "part_meaning": "старость, увядание, дряхлость"
      },
      {
        "part_iast": "maraṇa",
        "part_meaning": "смерть, кончина, умирание"
      }
    ],
    "note": "Два самостоятельных понятия объединены в составное слово (двандва-самаса), обозначающее единый завершающий этап жизни."
  },
  "origin": {
    "type": "заимствован и переосмыслен",
    "source_tradition": "Древнеиндийская (ведийская) традиция",
    "attestation_before_term": "Слова «джара» (jarā) и «марана» (maraṇa) встречаются в Ригведе и Упанишадах как естественный физический конец жизни или неизбежное зло земного существования.",
    "etymology_versions": [
      {
        "version": "От санскритских/палийских корней jṝ (стареть, дряхлеть) и mṛ (умирать).",
        "type": "академическая (филологическая)",
        "version_source": "Индоарийская филология / PTS Pali-English Dictionary",
        "status": "доминирующая"
      }
    ]
  },
  "dating": [
    {
      "type": "добуддийское бытование",
      "value": "I тыс. до н.э.",
      "comment": "Отдельные понятия старости и смерти активно использовались в ведийской литературе и ранних Упанишадах."
    },
    {
      "type": "академическая",
      "value": "V–IV вв. до н.э.",
      "comment": "Время жизни Будды Шакьямуни и формирования раннего буддийского канона, где термин стал звеном формулы взаимозависимого возникновения."
    }
  ],
  "attribution": {
    "traditional": "Будда Шакьямуни включил этот термин в качестве 12-го (заключительного) звена цепи взаимозависимого возникновения (патиччасамуппада) в своих первых проповедях.",
    "academic": "Термин зафиксирован в наиболеe раннем пласте буддийских сутт, отражая базовое представление раннего буддизма о неизбежности страдания в сансаре.",
    "consensus": "Полное согласие исследователей."
  },
  "recorded_by": "Первый буддийский собор в Раджагрихе (в устной традиции — Ананда); письменно зафиксирован монахами Тхеравады на Шри-Ланке.",
  "school_tradition": "Ранний буддизм / Тхеравада",
  "reason_introduced": "Термин был необходим, чтобы показать конечное проявление страдания в жизни любого существа. Он объясняет, к чему неизбежно приводит рождение и почему весь цикл перерождений наполнен болью.",
  "interpretation": "Это дряхлость тела, увядание чувств, седина, выпадение зубов (старость) и прекращение жизни, распад тела и уход из жизни (смерть). В буддизме это не просто естественный финал жизни, а неизбежное следствие самого факта рождения.",
  "language": "пали",
  "sources": [
    {
      "status": "основной",
      "title": "Маханидана-сутта",
      "location": "Dīgha Nikāya 15",
      "transmission_tradition": "Тхеравада",
      "language": "пали",
      "source_type": "канонический (Сутта-питака)",
      "discrepancies": ""
    },
    {
      "status": "свидетель 1",
      "title": "Самммадиттхи-сутта",
      "location": "Majjhima Nikāya 9",
      "transmission_tradition": "Тхеравада",
      "language": "пали",
      "source_type": "канонический (Сутта-питака)",
      "discrepancies": ""
    },
    {
      "status": "свидетель 2",
      "title": "Патиччасамуппада-вибханга-сутта",
      "location": "Saṁyutta Nikāya 12.2",
      "transmission_tradition": "Тхеравада",
      "language": "пали",
      "source_type": "канонический (Сутта-питака)",
      "discrepancies": ""
    }
  ],
  "later_mentions": [
    {
      "id": "buddhaghosa-visuddhimagga",
      "parent": "root",
      "author_id": "buddhaghosa",
      "date_updated": "V в. н.э.",
      "updated_by": "Буддхагхоса",
      "reason_for_update": "Требовалось дательное и системное объяснение того, как именно физический процесс увядания и смерти связан с ментальными факторами и прошлыми поступками.",
      "what_is_new": "Подробно разобраны признаки старости (созревание и увядание способностей) и смерти (исчезновение жизни, тепла и сознания), а также их роль как объекта для медитации о бренности.",
      "school_tradition": "Тхеравада (комментаторский период)",
      "source_type": "комментарий / трактат",
      "language": "пали",
      "source": {
        "title": "Висуддхимагга (глава XVII)"
      }
    }
  ]
}