{
  "id": "sila",
  "term_ru": "сила",
  "term_iast": "sīla",
  "term_composition": {
    "is_compound": false,
    "components": [],
    "note": ""
  },
  "origin": {
    "type": "заимствован и переосмыслен",
    "source_tradition": "Обычное индийское слово со значением «нрав, привычное поведение»; буддизм сделал из него название нравственной дисциплины.",
    "attestation_before_term": "В санскрите слово śīla означает «нрав, склад характера, обычное поведение». В таком, более широком смысле оно известно и вне буддизма.",
    "etymology_versions": [
      {
        "version": "От корня, связанного с «обыкновением, привычкой» (санскрит śīl — «упражняться, привыкать»): «привычное поведение», «нрав».",
        "type": "академическая (филологическая)",
        "version_source": "Словарь палийского языка Общества палийских текстов (PTS)",
        "status": "доминирующая"
      },
      {
        "version": "Sīlana — «собирание, упорядочивание» (слаженность поступков тела и речи) и «опора» (основа для всех хороших качеств).",
        "type": "традиционная / народная",
        "version_source": "Буддхагхоса, Висуддхимагга, глава 1",
        "status": "принята в традиции"
      }
    ]
  },
  "dating": [
    {
      "type": "добуддийское бытование",
      "value": "до V в. до н. э.",
      "comment": "Как обычное слово «нрав, поведение»."
    },
    {
      "type": "традиционная",
      "value": "время жизни Будды, V в. до н. э.",
      "comment": "Нравственность входит в обучение, которое Будда давал и мирянам, и монахам."
    },
    {
      "type": "академическая",
      "value": "ранний пласт Палийского канона, примерно V–IV вв. до н. э.",
      "comment": "Точно датировать отдельные суттры нельзя."
    }
  ],
  "attribution": {
    "traditional": "Традиция приписывает Будде схему из трёх упражнений — нравственность, сосредоточение, мудрость. Нравственность в ней идёт первой, как основа для остального.",
    "academic": "Учёные согласны, что слово существовало и до буддизма. Буддийское его употребление как названия отдельной ступени обучения относят к раннему слою канона. О том, как рано сложились списки из пяти и десяти правил, мнения различаются.",
    "consensus": "Согласие по основным вопросам: слово заимствованное, а его буддийское употребление раннее."
  },
  "recorded_by": "Составители Палийского канона (долго передавался устно, письменно записан на Шри-Ланке в I в. до н. э.)",
  "school_tradition": "Тхеравада (понятие общее для всех буддийских школ)",
  "reason_introduced": "Нужна была прочная основа, на которой держится вся практика: без спокойной совести и без вреда другим трудно успокоить ум. Поэтому нравственность поставили первой в ряду упражнений.",
  "interpretation": "Нравственность: умение не вредить себе и другим делом и словом. Для мирян это обычно пять правил: не убивать, не красть, не вести себя вредно в сфере чувств, не лгать, не употреблять опьяняющее. Для монахов правил больше.",
  "language": "пали",
  "sources": [
    {
      "status": "основной",
      "title": "Саманнапхала-сутта (Сутта о плодах подвижничества)",
      "location": "Dīgha Nikāya 2",
      "transmission_tradition": "Тхеравада",
      "language": "пали",
      "source_type": "канонический (Сутта-питака)",
      "discrepancies": "Параллельные версии есть в китайском и санскритском каноне; подробности перечня правил отличаются."
    },
    {
      "status": "свидетель 1",
      "title": "Сикка-сутта (Сутта о трёх упражнениях)",
      "location": "Aṅguttara Nikāya 3.88–3.89",
      "transmission_tradition": "Тхеравада",
      "language": "пали",
      "source_type": "канонический (Сутта-питака)",
      "discrepancies": ""
    },
    {
      "status": "свидетель 2",
      "title": "Кхуддакапатха (десять правил обучения)",
      "location": "Khuddakapāṭha 2",
      "transmission_tradition": "Тхеравада",
      "language": "пали",
      "source_type": "канонический (Кхуддака-никая)",
      "discrepancies": ""
    }
  ],
  "later_mentions": [
    {
      "id": "buddhaghosa",
      "parent": "root",
      "author_id": "buddhaghosa",
      "date_updated": "V в. н. э.",
      "updated_by": "Буддхагхоса",
      "reason_for_update": "Нужно было свести разрозненные правила в понятную систему и объяснить, как нравственность связана с остальным путём.",
      "what_is_new": "Нравственность делится на четыре вида очищения: соблюдение правил для монахов, сдерживание чувств, чистота способа добывать пропитание и разумное пользование необходимым. Каждому виду отведено своё место в практике.",
      "school_tradition": "Тхеравада (комментаторская традиция)",
      "source_type": "комментарий / трактат",
      "language": "пали",
      "source": { "title": "Висуддхимагга" }
    }
  ]
}
