{
  "id": "phassa",
  "term_ru": "пхасса",
  "term_iast": "phassa",
  "term_composition": {
    "is_compound": false,
    "components": [],
    "note": ""
  },
  "origin": {
    "type": "введён впервые",
    "source_tradition": "ранний буддизм",
    "attestation_before_term": "Отглагольное существительное от санскритского корня spṛś (касаться). В добуддийских ведийских текстах глагольные формы употреблялись в физическом смысле касания, но как фундаментальный психологический термин понятие сформулировано в буддизме.",
    "etymology_versions": [
      {
        "version": "Происходит от палийского глагола phusati (касаться) / санскритского корня spṛś (касание, контакт).",
        "type": "академическая (филологическая)",
        "version_source": "PTS Pali-English Dictionary",
        "status": "доминирующая"
      }
    ]
  },
  "dating": [
    {
      "type": "академическая",
      "value": "V–IV вв. до н. э.",
      "comment": "Период формирования раннебуддийского канона (Сутта-питака)"
    }
  ],
  "attribution": {
    "traditional": "Будде Шакьямуни (в контексте объяснения механизма восприятия и возникновения страдания в Патиччасамуппаде)",
    "academic": "Раннебуддийская общинная традиция V–IV вв. до н. э.",
    "consensus": "Высокая степень согласия: термин является базовым элементом раннебуддийской психологической системы."
  },
  "recorded_by": "Первоначально передавался устно (бханнака), зафиксирован письменно на ланкийском собрании в I в. до н. э.",
  "school_tradition": "Ранний буддизм / Тхеравада",
  "reason_introduced": "Термин понадобился для того, чтобы точечно объяснить, в какой именно момент возникает эмоциональная реакция человека. Он показывает, что восприятие — это не просто физическое касание, а встречный процесс, когда орган чувств, внешний предмет и сознание соединяются вместе.",
  "interpretation": "Пхасса — это столкновение органа чувств (например, глаза) с его объектом (например, цветом) и сознанием. Именно в момент этого «контакта» рождается приятное, неприятное или нейтральное ощущение, которое затем может превратиться в желание или привязанность.",
  "language": "пали",
  "sources": [
    {
      "status": "основной",
      "title": "Мадхупиндика-сутта",
      "location": "Majjhima Nikāya 18",
      "transmission_tradition": "Тхеравада",
      "language": "пали",
      "source_type": "канонический (Сутта-питака)",
      "discrepancies": ""
    },
    {
      "status": "свидетель 1",
      "title": "Маханидана-сутта",
      "location": "Dīgha Nikāya 15",
      "transmission_tradition": "Тхеравада",
      "language": "пали",
      "source_type": "канонический (Сутта-питака)",
      "discrepancies": ""
    }
  ],
  "later_mentions": [
    {
      "id": "buddhaghosa-visuddhimagga",
      "parent": "root",
      "author_id": "buddhaghosa",
      "date_updated": "V в. н. э.",
      "updated_by": "Буддхагхоса",
      "reason_for_update": "Нужно было систематизировать психологию и детально разложить внутренний процесс восприятия для практиков медитации.",
      "what_is_new": "Термин был строго классифицирован как одно из обязательных ментальных качеств (четасика), сопровождающих любой акт сознания, а также детально описаны его функция (соприкосновение) и проявление (сведение воедино объекта, чувства и органа).",
      "school_tradition": "Тхеравада (Абхидхамма)",
      "source_type": "комментаторский",
      "language": "пали",
      "source": {
        "title": "Висуддхимагга"
      }
    }
  ]
}