{
  "id": "dana",
  "term_ru": "дана",
  "term_iast": "dāna",
  "term_composition": {
    "is_compound": false,
    "components": [],
    "note": ""
  },
  "origin": {
    "type": "заимствован и переосмыслен",
    "source_tradition": "Обычное индийское слово «дар, подношение», известное ещё в ведийской традиции; буддизм сделал из него отдельную добродетель и ступень пути.",
    "attestation_before_term": "Слово dāna («дар») встречается в ведийских текстах задолго до буддизма, где речь шла о дарах жрецам и подношениях при обрядах.",
    "etymology_versions": [
      {
        "version": "От корня dā («давать») с суффиксом -na: «то, что даётся», «давание».",
        "type": "академическая (филологическая)",
        "version_source": "Словарь палийского языка Общества палийских текстов (PTS); общепринятое чтение",
        "status": "доминирующая"
      },
      {
        "version": "«То, посредством чего что-либо отдаётся»: толкование как действие отдавания.",
        "type": "традиционная / народная",
        "version_source": "Тхеравадинские комментарии",
        "status": "принята в традиции"
      }
    ]
  },
  "dating": [
    {
      "type": "добуддийское бытование",
      "value": "ведийский период, до V в. до н. э.",
      "comment": "Как обычное слово «дар»."
    },
    {
      "type": "традиционная",
      "value": "время жизни Будды, V в. до н. э.",
      "comment": "Будда говорил о даянии как о первом шаге в наставлении мирян."
    },
    {
      "type": "академическая",
      "value": "ранний пласт Палийского канона, примерно V–IV вв. до н. э.",
      "comment": "Точно датировать отдельные суттры нельзя."
    }
  ],
  "attribution": {
    "traditional": "Традиция приписывает Будде постепенное наставление для мирян: сначала рассказ о даянии, затем о нравственности, затем о небесных мирах, и только потом — о Четырёх благородных истинах.",
    "academic": "Учёные согласны, что слово существовало до буддизма. Особое буддийское значение — даяние как путь к очищению ума, а не только обряд ради заслуги — относят к раннему слою канона.",
    "consensus": "Согласие по основным вопросам: слово заимствованное, а его буддийское употребление раннее."
  },
  "recorded_by": "Составители Палийского канона (долго передавался устно, письменно записан на Шри-Ланке в I в. до н. э.)",
  "school_tradition": "Тхеравада (понятие общее для всех буддийских школ)",
  "reason_introduced": "Нужно было дать мирянам простое, доступное начало пути. Отдавать можно каждому, а это сразу ослабляет привязанность к вещам и «моё».",
  "interpretation": "Щедрость, добровольное и бескорыстное отдавание: вещей, еды, времени или помощи. В буддизме важно не только то, что отдано, но и с каким намерением; считается, что даяние очищает ум и приносит добрые плоды.",
  "language": "пали",
  "sources": [
    {
      "status": "основной",
      "title": "Группа бесед о даянии (восемь оснований для дара)",
      "location": "Aṅguttara Nikāya 8.31–8.36",
      "transmission_tradition": "Тхеравада",
      "language": "пали",
      "source_type": "канонический (Сутта-питака)",
      "discrepancies": ""
    },
    {
      "status": "свидетель 1",
      "title": "Итивуттака (о пользе делиться)",
      "location": "Itivuttaka 26",
      "transmission_tradition": "Тхеравада",
      "language": "пали",
      "source_type": "канонический (Кхуддака-никая)",
      "discrepancies": ""
    },
    {
      "status": "свидетель 2",
      "title": "Махаваргга (постепенное наставление: даяние, нравственность, небеса)",
      "location": "Vinaya Mahāvagga I.7 (Vin I 15)",
      "transmission_tradition": "Тхеравада",
      "language": "пали",
      "source_type": "канонический (Виная-питака)",
      "discrepancies": "Та же схема постепенного наставления есть в параллельных версиях других школ (на санскрите и китайском)."
    }
  ],
  "later_mentions": [
    {
      "id": "paramis",
      "parent": "root",
      "author_id": "buddhavamsa-jataka",
      "date_updated": "поздний пласт Палийского канона",
      "updated_by": "составители Буддхавамсы и Джатак",
      "reason_for_update": "Нужно было описать, какие качества Будда развивал на протяжении многих жизней, прежде чем стать Буддой.",
      "what_is_new": "Дана становится первой из десяти «совершенств» (парамит), которые будущий Будда развивает многие жизни. Щедрость теперь не только добродетель мирянина, но и основа пути бодхисатты.",
      "school_tradition": "Тхеравада",
      "source_type": "канонический (поздний пласт)",
      "language": "пали",
      "source": { "title": "Буддхавамса" }
    }
  ]
}
